<?xml version="1.0" encoding="UTF-8"?>
<!--<split xmlns:xs="http://www.w3.org/2001/XMLSchema-instance" xs:noNamespaceSchemaLocation="../../split.xsd">-->
<split xmlns:xs="http://www.w3.org/2001/XMLSchema-instance" xs:noNamespaceSchemaLocation="../../split_combine_process.xsd">
    <settings>
        <source>
            <ignore>
                <field>migration_split_me_table.is_new</field>
                <field>migration_split_me_table.value</field>
                <!--<field>migration_split_me_table.id</field>-->
                <!--<field>migration_split_me_table.account_id_split_1</field>-->
            </ignore>
            <move>
                <field>migration_split_me_table.id</field>
                <to>migration_split_me_table_person.to_move_test</to>
            </move>
            <move>
                <field>migration_split_me_table.id</field>
                <to>migration_split_me_table_person.main_table_id</to>
            </move>
            <!---->
            <!--<move>-->
                <!--<field>migration_combine_me_table_1.account_id</field>-->
                <!--<to>migration_combine_me_table.account_id</to>-->
            <!--</move>-->
            <!--<move>-->
                <!--<field>migration_combine_me_table_2.lastname_connect</field>-->
                <!--<to>migration_combine_me_table.lastname_connect</to>-->
            <!--</move>-->
            <!--<move>-->
                <!--<field>migration_combine_me_table_2.age</field>-->
                <!--<to>migration_combine_me_table.age</to>-->
            <!--</move>-->
            <!--<move>-->
                <!--<field>migration_combine_me_table_2.is_new</field>-->
                <!--<to>migration_combine_me_table.is_new</to>-->
            <!--</move>-->
            <!---->
        </source>
        <destination>
            <ignore>
                <datatype>migration_split_me_table_person.account_id_split_1</datatype>
                <datatype>migration_split_me_table_person.name_split_1</datatype>
            </ignore>
            <ignore>
                <!--<field>migration_split_me_table_person.to_move_test</field>-->
            </ignore>
            <ignore>
                <!--<field>migration_split_me_table_person.main_table_id</field>-->
            </ignore>
        </destination>
    </settings>
    <from>
        <documents>
            <document>migration_split_me_table</document>
        </documents>
    </from>
    <transfer>
        <document>migration_split_me_table_main</document>
        <document>migration_split_me_table_person</document>
    </transfer>
</split>
